{
  "schema_version": 1,
  "id": "dust_burst",
  "name": "Dust Burst",
  "duration": 1.4,
  "loop": false,
  "seed": 22380,
  "metadata": {
    "author": "",
    "description": "",
    "created_with": "VFX Forge 0.1.0",
    "notes": ""
  },
  "tags": [
    "dust",
    "impact",
    "environment"
  ],
  "layers": [
    {
      "name": "Dust Cloud",
      "enabled": true,
      "start": 0.0,
      "duration": 1.4,
      "properties": {
        "amount": 72,
        "one_shot": true,
        "lifetime": 1.2,
        "explosiveness": 0.8,
        "randomness": 0.15,
        "fixed_fps": 0,
        "local_coords": false,
        "emission_shape": "sphere",
        "emission_box_extents": [
          0.25,
          0.25,
          0.25
        ],
        "emission_radius": 0.35,
        "emission_height": 0.1,
        "direction": [
          0.0,
          1.0,
          0.0
        ],
        "spread": 35.0,
        "initial_velocity_min": 0.4,
        "initial_velocity_max": 1.5,
        "gravity": [
          0.0,
          0.4,
          0.0
        ],
        "damping": 0.0,
        "radial_accel": 0.0,
        "tangential_accel": 0.0,
        "turbulence": 0.0,
        "attractor_strength": 0.0,
        "attractor_position": [
          0.0,
          0.0,
          0.0
        ],
        "scale_min": 0.1,
        "scale_max": 0.25,
        "rotation_min": 0.0,
        "rotation_max": 360.0,
        "angular_velocity_min": -90.0,
        "angular_velocity_max": 90.0,
        "texture": "",
        "color": "#D4B78CFF"
      },
      "material": {
        "blend_mode": "additive",
        "unshaded": true,
        "billboard": "enabled",
        "depth_draw": "always",
        "texture": "",
        "tint": "#FFFFFFFF",
        "uv_scroll": [
          0.0,
          0.0
        ],
        "distortion": 0.0,
        "dissolve": 0.0,
        "fresnel": 0.0,
        "emissive_intensity": 1.0
      },
      "curves": {
        "scale": {
          "interpolation": "linear",
          "points": [
            {
              "x": 0.0,
              "y": 0.35
            },
            {
              "x": 0.15,
              "y": 1.0
            },
            {
              "x": 1.0,
              "y": 0.0
            }
          ]
        },
        "alpha": {
          "interpolation": "linear",
          "points": [
            {
              "x": 0.0,
              "y": 0.0
            },
            {
              "x": 0.1,
              "y": 1.0
            },
            {
              "x": 0.75,
              "y": 1.0
            },
            {
              "x": 1.0,
              "y": 0.0
            }
          ]
        },
        "velocity": {
          "interpolation": "linear",
          "points": [
            {
              "x": 0.0,
              "y": 1.0
            },
            {
              "x": 1.0,
              "y": 0.2
            }
          ]
        }
      },
      "gradient": [
        {
          "position": 0.0,
          "color": "#FFFFFFFF"
        },
        {
          "position": 1.0,
          "color": "#00000000"
        }
      ],
      "id": "dust_cloud",
      "type": "particle"
    },
    {
      "name": "Dust Shadow",
      "enabled": true,
      "start": 0.0,
      "duration": 1.0,
      "properties": {
        "texture": "",
        "size": [
          1.5,
          1.5
        ],
        "color": "#8B725044",
        "height": 0.02,
        "fade": true,
        "rotate": 0.0
      },
      "material": {
        "blend_mode": "additive",
        "unshaded": true,
        "billboard": "enabled",
        "depth_draw": "always",
        "texture": "",
        "tint": "#FFFFFFFF",
        "uv_scroll": [
          0.0,
          0.0
        ],
        "distortion": 0.0,
        "dissolve": 0.0,
        "fresnel": 0.0,
        "emissive_intensity": 1.0
      },
      "curves": {
        "scale": {
          "interpolation": "linear",
          "points": [
            {
              "x": 0.0,
              "y": 0.0
            },
            {
              "x": 0.2,
              "y": 1.0
            },
            {
              "x": 1.0,
              "y": 0.8
            }
          ]
        }
      },
      "gradient": [
        {
          "position": 0.0,
          "color": "#FFFFFFFF"
        },
        {
          "position": 1.0,
          "color": "#00000000"
        }
      ],
      "id": "dust_shadow",
      "type": "decal"
    }
  ],
  "dependencies": {
    "textures": [],
    "effects": [],
    "meshes": []
  },
  "timeline": {
    "events": [],
    "snap": 0.05
  },
  "camera_presets": {
    "front": {
      "position": [
        0.0,
        1.2,
        5.0
      ],
      "target": [
        0.0,
        0.8,
        0.0
      ],
      "fov": 45.0
    },
    "mmo": {
      "position": [
        4.5,
        4.0,
        5.5
      ],
      "target": [
        0.0,
        0.7,
        0.0
      ],
      "fov": 50.0
    },
    "top": {
      "position": [
        0.0,
        6.0,
        0.0
      ],
      "target": [
        0.0,
        0.0,
        0.0
      ],
      "fov": 45.0
    }
  },
  "budgets": {
    "profile": "Medium",
    "custom": {}
  },
  "export": {
    "godot_version": "4.x",
    "folder_name": "dust_burst",
    "include_metadata": true,
    "embed_document": true,
    "copy_textures": true,
    "copy_meshes": true
  }
}
