{
  "schema_version": 1,
  "id": "lightning_beam",
  "name": "Lightning Beam",
  "duration": 1.1,
  "loop": false,
  "seed": 71127,
  "metadata": {
    "author": "",
    "description": "",
    "created_with": "VFX Forge 0.1.0",
    "notes": ""
  },
  "tags": [
    "beam",
    "lightning",
    "boss"
  ],
  "layers": [
    {
      "name": "Bolt",
      "enabled": true,
      "start": 0.0,
      "duration": 0.95,
      "properties": {
        "source": [
          0.0,
          1.2,
          0.0
        ],
        "target": [
          0.0,
          1.0,
          -5.5
        ],
        "thickness": 0.16,
        "segments": 18,
        "noise": 0.22,
        "scroll_speed": 1.0,
        "fade": 1.0,
        "color": "#A9E8FFFF",
        "texture": ""
      },
      "material": {
        "blend_mode": "additive",
        "unshaded": true,
        "billboard": "enabled",
        "depth_draw": "always",
        "texture": "",
        "tint": "#FFFFFFFF",
        "uv_scroll": [
          0.0,
          0.0
        ],
        "distortion": 0.0,
        "dissolve": 0.0,
        "fresnel": 0.0,
        "emissive_intensity": 1.0
      },
      "curves": {
        "width": {
          "interpolation": "linear",
          "points": [
            {
              "x": 0.0,
              "y": 0.0
            },
            {
              "x": 0.12,
              "y": 1.0
            },
            {
              "x": 0.85,
              "y": 1.0
            },
            {
              "x": 1.0,
              "y": 0.0
            }
          ]
        }
      },
      "gradient": [
        {
          "position": 0.0,
          "color": "#FFFFFFFF"
        },
        {
          "position": 1.0,
          "color": "#00000000"
        }
      ],
      "id": "bolt",
      "type": "beam"
    },
    {
      "name": "Bolt Light",
      "enabled": true,
      "start": 0.0,
      "duration": 0.8,
      "properties": {
        "color": "#79D8FFFF",
        "energy": 4.5,
        "range": 5.0,
        "shadow_enabled": false,
        "fade": true
      },
      "material": {
        "blend_mode": "additive",
        "unshaded": true,
        "billboard": "enabled",
        "depth_draw": "always",
        "texture": "",
        "tint": "#FFFFFFFF",
        "uv_scroll": [
          0.0,
          0.0
        ],
        "distortion": 0.0,
        "dissolve": 0.0,
        "fresnel": 0.0,
        "emissive_intensity": 1.0
      },
      "curves": {
        "energy": {
          "interpolation": "linear",
          "points": [
            {
              "x": 0.0,
              "y": 0.0
            },
            {
              "x": 0.12,
              "y": 1.0
            },
            {
              "x": 0.7,
              "y": 0.55
            },
            {
              "x": 1.0,
              "y": 0.0
            }
          ]
        }
      },
      "gradient": [
        {
          "position": 0.0,
          "color": "#FFFFFFFF"
        },
        {
          "position": 1.0,
          "color": "#00000000"
        }
      ],
      "id": "bolt_light",
      "type": "light"
    },
    {
      "name": "Cast",
      "enabled": true,
      "start": 0.0,
      "duration": 0.05,
      "properties": {
        "event_id": "cast",
        "payload": {
          "channel": "lightning"
        }
      },
      "material": {
        "blend_mode": "additive",
        "unshaded": true,
        "billboard": "enabled",
        "depth_draw": "always",
        "texture": "",
        "tint": "#FFFFFFFF",
        "uv_scroll": [
          0.0,
          0.0
        ],
        "distortion": 0.0,
        "dissolve": 0.0,
        "fresnel": 0.0,
        "emissive_intensity": 1.0
      },
      "curves": {},
      "gradient": [
        {
          "position": 0.0,
          "color": "#FFFFFFFF"
        },
        {
          "position": 1.0,
          "color": "#00000000"
        }
      ],
      "id": "cast",
      "type": "event_marker"
    }
  ],
  "dependencies": {
    "textures": [],
    "effects": [],
    "meshes": []
  },
  "timeline": {
    "events": [],
    "snap": 0.05
  },
  "camera_presets": {
    "front": {
      "position": [
        0.0,
        1.2,
        5.0
      ],
      "target": [
        0.0,
        0.8,
        0.0
      ],
      "fov": 45.0
    },
    "mmo": {
      "position": [
        4.5,
        4.0,
        5.5
      ],
      "target": [
        0.0,
        0.7,
        0.0
      ],
      "fov": 50.0
    },
    "top": {
      "position": [
        0.0,
        6.0,
        0.0
      ],
      "target": [
        0.0,
        0.0,
        0.0
      ],
      "fov": 45.0
    }
  },
  "budgets": {
    "profile": "Medium",
    "custom": {}
  },
  "export": {
    "godot_version": "4.x",
    "folder_name": "lightning_beam",
    "include_metadata": true,
    "embed_document": true,
    "copy_textures": true,
    "copy_meshes": true
  }
}
